{
  "regression_id":"CPR-REG-0001",
  "reported_at":"2026-08-13T00:00:00Z",
  "reported_by":"owner",
  "source":"evaluation",
  "summary":"",
  "trigger":"",
  "affected_rule_ids":[],
  "affected_profile_ids":[],
  "expected_behavior":"",
  "observed_behavior":"",
  "fixture_ids":[],
  "severity":"medium",
  "status":"new",
  "owner":"",
  "decision_hook_ids":[],
  "retest_required":true,
  "retest_result":null,
  "closed_at":null
}
